{
  "namespace": "hop/integration-tests/sources",
  "name": "CRM-customer-product-line",
  "type": "DV_SOURCE",
  "description": "Customer-product line source for multi-active link satellite test case",
  "origin": {
    "modelType": "DATA_VAULT_SOURCE",
    "modelName": "link-satellite-driving-key",
    "modelFilename": "/integration-tests/tests//link-satellite-driving-key/link-satellite-driving-key.hdv",
    "modelElementName": "CRM-customer-product-line",
    "hopProject": "link-satellite-driving-key",
    "createdAt": 1782138125659,
    "updatedAt": 1782153230303,
    "updatedBy": null,
    "lastWorkflow": "update link-satellite-driving-key.hdv",
    "lastPipeline": null
  },
  "physicalTable": {
    "databaseMetaName": "CRM",
    "schemaName": "",
    "tableName": "customer_product_line"
  },
  "tags": [
    "DV Source",
    "FULL_SNAPSHOT"
  ],
  "glossaryTerms": [],
  "customProperties": {},
  "dvSource": {
    "sourceType": "DATABASE",
    "sourceIndicator": "CRM",
    "sourceIndicatorField": "record_source",
    "group": "",
    "deliveryType": "FULL_SNAPSHOT",
    "fields": [
      {
        "name": "customer_id",
        "description": "Customer business key",
        "sourceDataType": "Integer",
        "length": "9",
        "precision": "0",
        "hopType": 5
      },
      {
        "name": "product_id",
        "description": "Product business key",
        "sourceDataType": "String",
        "length": "7",
        "precision": "",
        "hopType": 2
      },
      {
        "name": "line_number",
        "description": "Driving key: line number within customer-product relationship",
        "sourceDataType": "Integer",
        "length": "9",
        "precision": "0",
        "hopType": 5
      },
      {
        "name": "quantity",
        "description": "Quantity purchased on this line",
        "sourceDataType": "Integer",
        "length": "9",
        "precision": "0",
        "hopType": 5
      },
      {
        "name": "discount_pct",
        "description": "Discount percentage",
        "sourceDataType": "Number",
        "length": "5",
        "precision": "2",
        "hopType": 1
      },
      {
        "name": "record_source",
        "description": "Record source indicator",
        "sourceDataType": "String",
        "length": "20",
        "precision": "",
        "hopType": 2
      }
    ]
  }
}
