{
  "namespace": "hop/integration-tests/sources",
  "name": "CRM-customer-phone",
  "type": "DV_SOURCE",
  "description": "Customer phone source for multi-active satellite test case",
  "origin": {
    "modelType": "DATA_VAULT_SOURCE",
    "modelName": "customer-phone",
    "modelFilename": "/integration-tests/tests//satellite-multi-active/customer-phone.hdv",
    "modelElementName": "CRM-customer-phone",
    "hopProject": "customer-phone",
    "createdAt": 1782138121677,
    "updatedAt": 1782153221190,
    "updatedBy": null,
    "lastWorkflow": "update customer-phone.hdv",
    "lastPipeline": null
  },
  "physicalTable": {
    "databaseMetaName": "CRM",
    "schemaName": "",
    "tableName": "customer_phone"
  },
  "tags": [
    "DV Source",
    "FULL_SNAPSHOT"
  ],
  "glossaryTerms": [],
  "customProperties": {},
  "dvSource": {
    "sourceType": "DATABASE",
    "sourceIndicator": "CRM",
    "sourceIndicatorField": "record_source",
    "group": "",
    "deliveryType": "FULL_SNAPSHOT",
    "fields": [
      {
        "name": "customer_id",
        "description": "Customer business key",
        "sourceDataType": "Integer",
        "length": "9",
        "precision": "0",
        "hopType": 5
      },
      {
        "name": "phone_type",
        "description": "Driving key: HOME, MOBILE, WORK, ...",
        "sourceDataType": "String",
        "length": "10",
        "precision": "",
        "hopType": 2
      },
      {
        "name": "phone_number",
        "description": "Phone number",
        "sourceDataType": "String",
        "length": "20",
        "precision": "",
        "hopType": 2
      },
      {
        "name": "record_source",
        "description": "Record source indicator",
        "sourceDataType": "String",
        "length": "20",
        "precision": "",
        "hopType": 2
      }
    ]
  }
}
