{
  "namespace": "hop/integration-tests/sources",
  "name": "CRM-country-ref",
  "type": "DV_SOURCE",
  "description": "Country code list for physical Reference table FULL_REPLACE tests",
  "origin": {
    "modelType": "DATA_VAULT_SOURCE",
    "modelName": "reference-table",
    "modelFilename": "${PROJECT_HOME}/tests/reference-table/reference-table.hdv",
    "modelElementName": "CRM-country-ref",
    "hopProject": "hop-data-vault",
    "createdAt": 1783000000000,
    "updatedAt": 1783000000000,
    "updatedBy": null,
    "lastWorkflow": null,
    "lastPipeline": null
  },
  "physicalTable": {
    "databaseMetaName": "CRM",
    "schemaName": "",
    "tableName": "country_ref"
  },
  "tags": [
    "DV Source",
    "FULL_SNAPSHOT"
  ],
  "glossaryTerms": [],
  "customProperties": {},
  "dvSource": {
    "sourceType": "DATABASE",
    "sourceIndicator": "CRM",
    "sourceIndicatorField": "",
    "group": "",
    "deliveryType": "FULL_SNAPSHOT",
    "fields": [
      {
        "name": "code",
        "description": "ISO country code",
        "sourceDataType": "String",
        "length": "3",
        "precision": "",
        "hopType": 2
      },
      {
        "name": "name",
        "description": "Country display name",
        "sourceDataType": "String",
        "length": "100",
        "precision": "",
        "hopType": 2
      }
    ]
  }
}
