{
  "namespace": "hop/integration-tests/sources",
  "name": "CRM-order",
  "type": "DV_SOURCE",
  "description": "",
  "origin": {
    "modelType": "DATA_VAULT_SOURCE",
    "modelName": null,
    "modelFilename": null,
    "modelElementName": "CRM-order",
    "hopProject": null,
    "createdAt": null,
    "updatedAt": 1782128483653,
    "updatedBy": null,
    "lastWorkflow": null,
    "lastPipeline": null
  },
  "physicalTable": {
    "databaseMetaName": "CRM",
    "schemaName": "",
    "tableName": "order"
  },
  "tags": [
    "DV Source",
    "FULL_SNAPSHOT"
  ],
  "glossaryTerms": [],
  "customProperties": {},
  "dvSource": {
    "sourceType": "DATABASE",
    "sourceIndicator": "",
    "sourceIndicatorField": "record_source",
    "group": null,
    "deliveryType": "FULL_SNAPSHOT",
    "fields": [
      {
        "name": "order_id",
        "description": "",
        "sourceDataType": "String",
        "length": "7",
        "precision": "",
        "hopType": 2
      },
      {
        "name": "customer_id",
        "description": "",
        "sourceDataType": "Integer",
        "length": "9",
        "precision": "0",
        "hopType": 5
      },
      {
        "name": "product_id",
        "description": "",
        "sourceDataType": "String",
        "length": "7",
        "precision": "",
        "hopType": 2
      },
      {
        "name": "quantity",
        "description": "",
        "sourceDataType": "Integer",
        "length": "9",
        "precision": "0",
        "hopType": 5
      },
      {
        "name": "unit_price",
        "description": "",
        "sourceDataType": "Number",
        "length": "9",
        "precision": "2",
        "hopType": 1
      },
      {
        "name": "order_date",
        "description": "",
        "sourceDataType": "Timestamp",
        "length": "6",
        "precision": "",
        "hopType": 9
      },
      {
        "name": "load_date",
        "description": "",
        "sourceDataType": "Timestamp",
        "length": "6",
        "precision": "",
        "hopType": 9
      },
      {
        "name": "record_source",
        "description": "",
        "sourceDataType": "String",
        "length": "20",
        "precision": "",
        "hopType": 2
      }
    ]
  }
}
