{
  "namespace": "hop/integration-tests/sources",
  "name": "CRM-party-hrp",
  "type": "DV_SOURCE",
  "description": "Party master for hub-alias role-playing test",
  "origin": {
    "modelType": "DATA_VAULT_SOURCE",
    "modelName": "hub-alias-role-playing",
    "modelFilename": "/integration-tests/tests//hub-alias-role-playing/hub-alias-role-playing.hdv",
    "modelElementName": "CRM-party-hrp",
    "hopProject": "hub-alias-role-playing",
    "createdAt": 1782138125659,
    "updatedAt": 1782153230303,
    "updatedBy": null,
    "lastWorkflow": null,
    "lastPipeline": null
  },
  "physicalTable": {
    "databaseMetaName": "CRM",
    "schemaName": "",
    "tableName": "party_hrp"
  },
  "tags": [
    "DV Source",
    "FULL_SNAPSHOT"
  ],
  "glossaryTerms": [],
  "customProperties": {},
  "dvSource": {
    "sourceType": "DATABASE",
    "sourceIndicator": "CRM",
    "sourceIndicatorField": "record_source",
    "group": "",
    "deliveryType": "FULL_SNAPSHOT",
    "fields": [
      {
        "name": "party_id",
        "description": "Party business key",
        "sourceDataType": "Integer",
        "length": "9",
        "precision": "0",
        "hopType": 5
      },
      {
        "name": "record_source",
        "description": "Record source indicator",
        "sourceDataType": "String",
        "length": "20",
        "precision": "",
        "hopType": 2
      }
    ]
  }
}
