{
  "namespace": "hop/integration-tests/sources",
  "name": "CRM-product",
  "type": "DV_SOURCE",
  "description": "",
  "origin": {
    "modelType": "DATA_VAULT_SOURCE",
    "modelName": null,
    "modelFilename": null,
    "modelElementName": "CRM-product",
    "hopProject": null,
    "createdAt": null,
    "updatedAt": 1782128483653,
    "updatedBy": null,
    "lastWorkflow": null,
    "lastPipeline": null
  },
  "physicalTable": {
    "databaseMetaName": "CRM",
    "schemaName": "",
    "tableName": "product"
  },
  "tags": [
    "DV Source",
    "CHANGES_ONLY"
  ],
  "glossaryTerms": [],
  "customProperties": {},
  "dvSource": {
    "sourceType": "DATABASE",
    "sourceIndicator": "",
    "sourceIndicatorField": "record_source",
    "group": null,
    "deliveryType": "CHANGES_ONLY",
    "fields": [
      {
        "name": "product_id",
        "description": "",
        "sourceDataType": "String",
        "length": "7",
        "precision": "",
        "hopType": 2
      },
      {
        "name": "product_name",
        "description": "",
        "sourceDataType": "String",
        "length": "50",
        "precision": "",
        "hopType": 2
      },
      {
        "name": "category",
        "description": "",
        "sourceDataType": "String",
        "length": "50",
        "precision": "",
        "hopType": 2
      },
      {
        "name": "unit_price",
        "description": "",
        "sourceDataType": "Number",
        "length": "9",
        "precision": "2",
        "hopType": 1
      },
      {
        "name": "load_date",
        "description": "",
        "sourceDataType": "Timestamp",
        "length": "6",
        "precision": "",
        "hopType": 9
      },
      {
        "name": "record_source",
        "description": "",
        "sourceDataType": "String",
        "length": "20",
        "precision": "",
        "hopType": 2
      }
    ]
  }
}
