{
  "namespace": "hop/integration-tests/sources",
  "name": "CRM-customer-online",
  "type": "DV_SOURCE",
  "description": "Online CRM customer feed for multi-source hub test",
  "origin": {
    "modelType": "DATA_VAULT_SOURCE",
    "modelName": "multi-source-hub",
    "modelFilename": "/integration-tests/tests//multi-source-hub/multi-source-hub.hdv",
    "modelElementName": "CRM-customer-online",
    "hopProject": "multi-source-hub",
    "createdAt": 1782138131428,
    "updatedAt": 1782153242078,
    "updatedBy": null,
    "lastWorkflow": "update multi-source-hub.hdv",
    "lastPipeline": null
  },
  "physicalTable": {
    "databaseMetaName": "CRM",
    "schemaName": "",
    "tableName": "customer_online"
  },
  "tags": [
    "DV Source",
    "CHANGES_ONLY"
  ],
  "glossaryTerms": [],
  "customProperties": {},
  "dvSource": {
    "sourceType": "DATABASE",
    "sourceIndicator": "",
    "sourceIndicatorField": "record_source",
    "group": "",
    "deliveryType": "CHANGES_ONLY",
    "fields": [
      {
        "name": "customer_id",
        "description": "Customer business key",
        "sourceDataType": "Integer",
        "length": "9",
        "precision": "0",
        "hopType": 5
      },
      {
        "name": "username",
        "description": "Online username",
        "sourceDataType": "String",
        "length": "50",
        "precision": "",
        "hopType": 2
      },
      {
        "name": "membership_level",
        "description": "Membership tier",
        "sourceDataType": "String",
        "length": "20",
        "precision": "",
        "hopType": 2
      },
      {
        "name": "record_source",
        "description": "Record source indicator",
        "sourceDataType": "String",
        "length": "20",
        "precision": "",
        "hopType": 2
      }
    ]
  }
}
