{
  "namespace": "hop/integration-tests/sources",
  "name": "CRM-load-end-date",
  "type": "DV_SOURCE",
  "description": "Customer source for load end date satellite test case",
  "origin": {
    "modelType": "DATA_VAULT_SOURCE",
    "modelName": "load-end-date",
    "modelFilename": "/integration-tests/tests//load-end-date/load-end-date.hdv",
    "modelElementName": "CRM-load-end-date",
    "hopProject": "load-end-date",
    "createdAt": 1782138127448,
    "updatedAt": 1782153234130,
    "updatedBy": null,
    "lastWorkflow": "update load-end-date.hdv",
    "lastPipeline": null
  },
  "physicalTable": {
    "databaseMetaName": "CRM",
    "schemaName": "",
    "tableName": "customer_led"
  },
  "tags": [
    "DV Source",
    "FULL_SNAPSHOT"
  ],
  "glossaryTerms": [],
  "customProperties": {},
  "dvSource": {
    "sourceType": "DATABASE",
    "sourceIndicator": "CRM",
    "sourceIndicatorField": "record_source",
    "group": "",
    "deliveryType": "FULL_SNAPSHOT",
    "fields": [
      {
        "name": "customer_id",
        "description": "Customer business key",
        "sourceDataType": "Integer",
        "length": "9",
        "precision": "0",
        "hopType": 5
      },
      {
        "name": "name",
        "description": "Customer name",
        "sourceDataType": "String",
        "length": "50",
        "precision": "",
        "hopType": 2
      },
      {
        "name": "email",
        "description": "Customer email",
        "sourceDataType": "String",
        "length": "50",
        "precision": "",
        "hopType": 2
      },
      {
        "name": "record_source",
        "description": "Record source indicator",
        "sourceDataType": "String",
        "length": "20",
        "precision": "",
        "hopType": 2
      }
    ]
  }
}
