{
  "namespace": "hop/integration-tests/sources",
  "name": "CRM-burger-ext",
  "type": "DV_SOURCE",
  "description": "EXT-style two-part identity feed for composite hub business key integration test",
  "rowMetaXml": "<row-meta><value-meta><type>String</type>\n<storagetype>normal</storagetype>\n<name>num_seq_bkcc_bk</name>\n<length>10</length>\n<precision>-1</precision>\n<origin/>\n<comments/>\n<conversion_Mask/>\n<decimal_symbol>.</decimal_symbol>\n<grouping_symbol>,</grouping_symbol>\n<currency_symbol>$</currency_symbol>\n<trim_type>none</trim_type>\n<case_insensitive>N</case_insensitive>\n<collator_disabled>Y</collator_disabled>\n<collator_strength>0</collator_strength>\n<sort_descending>N</sort_descending>\n<output_padding>N</output_padding>\n<date_format_lenient>N</date_format_lenient>\n<date_format_locale>en_US</date_format_locale>\n<date_format_timezone>GMT</date_format_timezone>\n<lenient_string_to_number>N</lenient_string_to_number>\n</value-meta><value-meta><type>String</type>\n<storagetype>normal</storagetype>\n<name>num_seq_bk</name>\n<length>20</length>\n<precision>-1</precision>\n<origin/>\n<comments/>\n<conversion_Mask/>\n<decimal_symbol>.</decimal_symbol>\n<grouping_symbol>,</grouping_symbol>\n<currency_symbol>$</currency_symbol>\n<trim_type>none</trim_type>\n<case_insensitive>N</case_insensitive>\n<collator_disabled>Y</collator_disabled>\n<collator_strength>0</collator_strength>\n<sort_descending>N</sort_descending>\n<output_padding>N</output_padding>\n<date_format_lenient>N</date_format_lenient>\n<date_format_locale>en_US</date_format_locale>\n<date_format_timezone>GMT</date_format_timezone>\n<lenient_string_to_number>N</lenient_string_to_number>\n</value-meta><value-meta><type>String</type>\n<storagetype>normal</storagetype>\n<name>status</name>\n<length>20</length>\n<precision>-1</precision>\n<origin/>\n<comments/>\n<conversion_Mask/>\n<decimal_symbol>.</decimal_symbol>\n<grouping_symbol>,</grouping_symbol>\n<currency_symbol>$</currency_symbol>\n<trim_type>none</trim_type>\n<case_insensitive>N</case_insensitive>\n<collator_disabled>Y</collator_disabled>\n<collator_strength>0</collator_strength>\n<sort_descending>N</sort_descending>\n<output_padding>N</output_padding>\n<date_format_lenient>N</date_format_lenient>\n<date_format_locale>en_US</date_format_locale>\n<date_format_timezone>GMT</date_format_timezone>\n<lenient_string_to_number>N</lenient_string_to_number>\n</value-meta></row-meta>",
  "origin": {
    "modelType": "DATA_VAULT_SOURCE",
    "modelName": "composite-hub-bk",
    "modelFilename": "/integration-tests/tests/composite-hub-bk/composite-hub-bk.hdv",
    "modelElementName": "CRM-burger-ext",
    "hopProject": "composite-hub-bk",
    "createdAt": null,
    "updatedAt": null,
    "updatedBy": null,
    "lastWorkflow": null,
    "lastPipeline": null
  },
  "physicalTable": {
    "databaseMetaName": "CRM",
    "schemaName": "",
    "tableName": "burger_ext"
  },
  "tags": [
    "DV Source",
    "FULL_SNAPSHOT"
  ],
  "glossaryTerms": [],
  "customProperties": {},
  "dvSource": {
    "sourceType": "DATABASE",
    "sourceIndicator": "CRM",
    "sourceIndicatorField": "",
    "group": "",
    "deliveryType": "FULL_SNAPSHOT",
    "fields": [
      {
        "name": "num_seq_bkcc_bk",
        "description": "Business key part 1 (code)",
        "sourceDataType": "String",
        "length": "10",
        "precision": "",
        "hopType": 2
      },
      {
        "name": "num_seq_bk",
        "description": "Business key part 2 (sequence)",
        "sourceDataType": "String",
        "length": "20",
        "precision": "",
        "hopType": 2
      },
      {
        "name": "status",
        "description": "Descriptive status attribute",
        "sourceDataType": "String",
        "length": "20",
        "precision": "",
        "hopType": 2
      }
    ]
  }
}
